{
  "id": "cinema_anamorphic_133",
  "displayName": "Cinema Anamorphic 1.33x",
  "resolution": { "width": 3840, "height": 2160 },
  "frameRateFps": 24,
  "shutter": { "mode": "angle", "shutterAngleDegrees": 180 },
  "isoMin": 100,
  "isoMax": 3200,
  "whiteBalanceKelvin": 5600,
  "tint": 0,
  "focusMode": "manual",
  "codec": "hevc10",
  "bitrateBps": 180000000,
  "bitDepth": 10,
  "colorProfile": "flat_approximation",
  "lutId": "rec709_neutral_monitor",
  "stabilization": "off",
  "audioSource": "internal_mic",
  "storageTarget": "internal",
  "thermalProfileId": "balanced_field",
  "monitoringOverlays": ["histogram", "focus_peaking", "anamorphic_desqueeze", "frame_guides"],
  "lensMetadataDefaults": { "anamorphicSqueeze": 1.33 },
  "buttonMappingId": "default"
}
