{
  "id": "cinema_tripod_manual",
  "displayName": "Cinema Tripod Full Manual",
  "resolution": { "width": 3840, "height": 2160 },
  "frameRateFps": 24,
  "shutter": { "mode": "speed_fraction", "shutterSpeedDenominator": 50 },
  "isoMin": 100,
  "isoMax": 1600,
  "whiteBalanceKelvin": 5600,
  "tint": 0,
  "focusMode": "manual",
  "codec": "hevc10",
  "bitrateBps": 180000000,
  "bitDepth": 10,
  "colorProfile": "flat_approximation",
  "lutId": "rec709_neutral_monitor",
  "stabilization": "off",
  "audioSource": "usb_audio",
  "storageTarget": "internal",
  "thermalProfileId": "balanced_field",
  "monitoringOverlays": ["histogram", "zebra", "focus_peaking", "lut_preview", "frame_guides"],
  "buttonMappingId": "default"
}
